ticker,source,title,description,published_at,url,full_text
AAPL,The Gadgeteer,The Most Expensive E-Ink Tablet You Can Buy Does Almost Nothing,"Every year, tablets get faster chips, sharper cameras, and another wave of apps nobody asked for. The whole category has been sprinting toward “do everything” for over a decade, packing screens with notifications and content feeds that fight for your attentio…",2026-02-22,https://the-gadgeteer.com/2026/02/22/the-most-expensive-e-ink-tablet-you-can-buy-does-almost-nothing/,"The Most Expensive E-Ink Tablet You Can Buy Does Almost Nothing Every year, tablets get faster chips, sharper cameras, and another wave of apps nobody asked for. The whole category has been sprinting toward “do everything” for over a decade, packing screens with notifications and content feeds that fight for your attentio…"
AAPL,The Irish Times,‘It was terrible’: Roofs lifted off sheds as ‘mini-tornado’ hits in Co Tipperary,Met Éireann estimates that 10 such incidents occur in Ireland each year,2026-02-22,https://www.irishtimes.com/ireland/2026/02/22/it-was-terrible-roofs-lifted-off-sheds-as-mini-tornado-hits-in-co-tipperary/,‘It was terrible’: Roofs lifted off sheds as ‘mini-tornado’ hits in Co Tipperary Met Éireann estimates that 10 such incidents occur in Ireland each year
AAPL,Notebookcheck.net,Steam Deck shortage goes global as AI memory crunch deepens,"The Steam Deck is now out of stock across much of Europe, Canada, and Japan, as memory and storage shortages linked to the AI data center boom disrupt supply. Valve confirms the issue, with restocking timelines still unclear in several regions.",2026-02-22,https://www.notebookcheck.net/Steam-Deck-shortage-goes-global-as-AI-memory-crunch-deepens.1232025.0.html,"Steam Deck shortage goes global as AI memory crunch deepens The Steam Deck is now out of stock across much of Europe, Canada, and Japan, as memory and storage shortages linked to the AI data center boom disrupt supply. Valve confirms the issue, with restocking timelines still unclear in several regions."
AAPL,Pypi.org,basisdata-mcp added to PyPI,"MCP server for BasisData financial data API -- SEC EDGAR filings, company financials, and screening tools for 7,000+ US public companies",2026-02-22,https://pypi.org/project/basisdata-mcp/,"basisdata-mcp added to PyPI MCP server for BasisData financial data API -- SEC EDGAR filings, company financials, and screening tools for 7,000+ US public companies"
AAPL,Phoronix,Yet Another Fix Coming For Older AMD GPUs On Linux - Thanks To Valve Developer,Timur Kristóf of Valve's open-source Linux graphics driver team has been doing a fantastic job enhancing the older AMD Radeon GPU support under Linux. Last year he made enough improvements to the AMDGPU open-source driver that older Radeon GCN 1.0/1.1 dGPUs s…,2026-02-22,https://www.phoronix.com/news/Hawaii-Macs-AMDGPU-DC-Fix,Yet Another Fix Coming For Older AMD GPUs On Linux - Thanks To Valve Developer Timur Kristóf of Valve's open-source Linux graphics driver team has been doing a fantastic job enhancing the older AMD Radeon GPU support under Linux. Last year he made enough improvements to the AMDGPU open-source driver that older Radeon GCN 1.0/1.1 dGPUs s…
AAPL,Land-Grant Holy Land,Good Hoops Morning: Ohio State faces No. 15 Michigan State in the house that Dale Bonner built,Why not start your morning with college basketball?,2026-02-22,https://www.landgrantholyland.com/ohio-state-mens-basketball/113117/good-hoops-morning-ohio-state-faces-no-15-michigan-state-in-the-house-that-dale-bonner-built,Good Hoops Morning: Ohio State faces No. 15 Michigan State in the house that Dale Bonner built Why not start your morning with college basketball?
AAPL,Pypi.org,flync-ml added to PyPI,FLYNC: lncRNA discovery pipeline for Drosophila melanogaster,2026-02-22,https://pypi.org/project/flync-ml/,flync-ml added to PyPI FLYNC: lncRNA discovery pipeline for Drosophila melanogaster
AAPL,Worldsoccertalk.com,How to watch Barcelona vs Levante in the USA: Live Stream and TV for 2025/2026 La Liga,"Barcelona receive Levante in a Matchday 25 clash during the 2025/26 La Liga campaign. Here’s all the essential information you need ahead of kickoff, including start times and how to catch the game live on TV and streaming platforms.
 
Here are all of the det…",2026-02-22,https://worldsoccertalk.com/watch-on-us-tv/how-to-watch-barcelona-vs-levante-in-the-usa-live-stream-and-tv-for-2025-2026-la-liga/,"How to watch Barcelona vs Levante in the USA: Live Stream and TV for 2025/2026 La Liga Barcelona receive Levante in a Matchday 25 clash during the 2025/26 La Liga campaign. Here’s all the essential information you need ahead of kickoff, including start times and how to catch the game live on TV and streaming platforms.
 
Here are all of the det…"
AAPL,Middle East Eye,Starmer Is Toast. But the Dark Forces that Brought Him to Power Are as Strong as Ever,The political and media classes that once venerated Mandelson and are now cutting him adrift are the same ones that spent five years destroying Corbyn,2026-02-22,https://www.middleeasteye.net/opinion/starmer-toast-dark-forces-brought-him-power-are-strong-ever,Starmer Is Toast. But the Dark Forces that Brought Him to Power Are as Strong as Ever The political and media classes that once venerated Mandelson and are now cutting him adrift are the same ones that spent five years destroying Corbyn
AAPL,The Times of India,"‘The 50’: Lovekesh Kataria calls out spoilers ahead of the finale; says, “Please mat karo”",Reality show 'The 50' contestant Lovekesh Kataria has urged fans and media to stop sharing spoilers about the already filmed finale. He believes spoilers diminish the audience's excitement and the show's overall impact. Kataria emphasized that avoiding spoile…,2026-02-22,https://timesofindia.indiatimes.com/tv/news/hindi/the-50-lovekesh-kataria-calls-out-spoilers-ahead-of-the-finale-says-please-mat-karo/articleshow/128674479.cms,"‘The 50’: Lovekesh Kataria calls out spoilers ahead of the finale; says, “Please mat karo” Reality show 'The 50' contestant Lovekesh Kataria has urged fans and media to stop sharing spoilers about the already filmed finale. He believes spoilers diminish the audience's excitement and the show's overall impact. Kataria emphasized that avoiding spoile…"
AAPL,RTE,LOI Preview: Rovers looking to complete perfect weekend,Shamrock Rovers are looking for a second win in four days against unbeaten Dundalk in a re-fixed SSE Airtricity League game at Tallaght Stadium this evening.,2026-02-22,https://www.rte.ie/sport/soccer/2026/0222/1559792-loi-preview-rovers-looking-to-complete-perfect-weekend/,LOI Preview: Rovers looking to complete perfect weekend Shamrock Rovers are looking for a second win in four days against unbeaten Dundalk in a re-fixed SSE Airtricity League game at Tallaght Stadium this evening.
AAPL,Bavarian Football Works,What is your spiciest Bayern Munich hot take that you actually believe?,Do you have any FC Bayern hot takes holstered?,2026-02-22,https://www.bavarianfootballworks.com/question-of-the-day/170921/what-is-your-spiciest-bayern-munich-hot-take-that-you-actually-believe,What is your spiciest Bayern Munich hot take that you actually believe? Do you have any FC Bayern hot takes holstered?
AAPL,Github.com,GitHub - ochyai/vibe-local: Free AI coding environment: Ollama + Claude Code CLI on Apple Silicon Mac,You signed in with another tab or window. Reload to refresh your session. You signed out in another tab or window. Reload to refresh your session. You switched accounts on another tab or window. Reload to refresh your session. Dismiss alert,2026-02-22,https://github.com/ochyai/vibe-local,GitHub - ochyai/vibe-local: Free AI coding environment: Ollama + Claude Code CLI on Apple Silicon Mac You signed in with another tab or window. Reload to refresh your session. You signed out in another tab or window. Reload to refresh your session. You switched accounts on another tab or window. Reload to refresh your session. Dismiss alert
AAPL,Github.com,Show HN: Zog parsing JSONL at 3 GB/s by not parsing it,"Article URL: https://github.com/aikoschurmann/zog
Comments URL: https://news.ycombinator.com/item?id=47109971
Points: 1
# Comments: 0",2026-02-22,https://github.com/aikoschurmann/zog,"Show HN: Zog parsing JSONL at 3 GB/s by not parsing it Article URL: https://github.com/aikoschurmann/zog
Comments URL: https://news.ycombinator.com/item?id=47109971
Points: 1
# Comments: 0"
AAPL,Boston Herald,MLB notes: Next media deals could mean more for baseball than salary cap,"While talks of a salary cap are certain to dominate baseball over the next year, MLB's upcoming broadcast rights negotiations could have an even bigger impact on the sport.",2026-02-22,https://www.bostonherald.com/2026/02/22/mlb-notes-next-media-deals-could-mean-more-for-baseball-than-salary-cap/,"MLB notes: Next media deals could mean more for baseball than salary cap While talks of a salary cap are certain to dominate baseball over the next year, MLB's upcoming broadcast rights negotiations could have an even bigger impact on the sport."
AAPL,TechRadar,"I wore this rugged Suunto smartwatch for months, and I reckon Garmin's got competition in the outdoor superwatch arena","With an enormous battery life and a crisp AOLED display, the Suunto Vertical 2 has some of Garmin's most powerful adventure watches in its sights",2026-02-22,https://www.techradar.com/health-fitness/smartwatches/suunto-vertical-2-review,"I wore this rugged Suunto smartwatch for months, and I reckon Garmin's got competition in the outdoor superwatch arena With an enormous battery life and a crisp AOLED display, the Suunto Vertical 2 has some of Garmin's most powerful adventure watches in its sights"
AAPL,Slate Magazine,The Future of Retail is A.I.,"Get in, loser; we’re going shopping and A.I. is coming too.",2026-02-22,https://slate.com/podcasts/what-next-tbd/2026/02/artificial-intelligence-goes-shopping,"The Future of Retail is A.I. Get in, loser; we’re going shopping and A.I. is coming too."
AAPL,Empire of The Kop,Sutton’s Liverpool prediction comes with warning about Forest,"Liverpool’s Premier League trip to Nottingham Forest comes with the usual City Ground nerves, and Chris Sutton has now made his prediction for Arne Slot’s side ahead of Sunday’s 2pm kick-off.The...",2026-02-22,https://www.empireofthekop.com/2026/02/22/suttons-liverpool-prediction-comes-with-warning-about-forest/,"Sutton’s Liverpool prediction comes with warning about Forest Liverpool’s Premier League trip to Nottingham Forest comes with the usual City Ground nerves, and Chris Sutton has now made his prediction for Arne Slot’s side ahead of Sunday’s 2pm kick-off.The..."
AAPL,Detroit Free Press,What MSU basketball must do to bolster résumé with OSU coming to town,"Michigan State basketball hosts Ohio State on Sunday (1 p.m., CBS), the 27th straight game the Spartans face a team for the first time this season.",2026-02-22,https://www.freep.com/story/sports/college/michigan-state/spartans/2026/02/22/michigan-state-basketball-ncaa-tournament-bracketology/88799101007/,"What MSU basketball must do to bolster résumé with OSU coming to town Michigan State basketball hosts Ohio State on Sunday (1 p.m., CBS), the 27th straight game the Spartans face a team for the first time this season."
AAPL,Bavarian Football Works,Vincent Kompany describes his favorite moment as manager at Bayern Munich,Vincent Kompany’s career has been filled with memorable moments.,2026-02-22,https://www.bavarianfootballworks.com/bayern-munich-bundesliga/169913/vincent-kompany-manchester-city-stuttgart-kingsley-coman,Vincent Kompany describes his favorite moment as manager at Bayern Munich Vincent Kompany’s career has been filled with memorable moments.
AAPL,Cartoon Brew,"‘KPop Demon Hunters’ Sweeps The 2026 Annie Awards, Winning All 10 Awards For Which It Was Nominated","Here's our full rundown of the 53rd Annie Awards, including all the winners and the glamorous evening's most memorable presenters and moments.",2026-02-22,https://www.cartoonbrew.com/awards/annie-awards-winners-kpop-demon-hunters-259031.html,"‘KPop Demon Hunters’ Sweeps The 2026 Annie Awards, Winning All 10 Awards For Which It Was Nominated Here's our full rundown of the 53rd Annie Awards, including all the winners and the glamorous evening's most memorable presenters and moments."
AAPL,Wccftech,"Galaxy S26 Ultra’s Battery Runtime Concerns Downplayed By Tipster, Says The 5,000mAh Cell Will Last For Much Longer, But The Comparison Says Otherwise","Samsung’s penchant for sticking to a ‘safer’ approach for its flagship smartphones is undoubtedly one of the reasons why the company has fallen out of favor with consumers, losing its top spot to Apple. Even now, the Korean giant has limited the Galaxy S26 Ul…",2026-02-22,https://wccftech.com/galaxy-s26-ultra-5000mah-battery-concerns-downplayed-by-tipster/,"Galaxy S26 Ultra’s Battery Runtime Concerns Downplayed By Tipster, Says The 5,000mAh Cell Will Last For Much Longer, But The Comparison Says Otherwise Samsung’s penchant for sticking to a ‘safer’ approach for its flagship smartphones is undoubtedly one of the reasons why the company has fallen out of favor with consumers, losing its top spot to Apple. Even now, the Korean giant has limited the Galaxy S26 Ul…"
AAPL,Alltoc.com,Is a low-cost MacBook coming? #lifestyle,"Apple event rumors and what to expect Reports point to an ""Apple Experience"" event scheduled for March 4 across New York, London, and Shanghai where the company may unveil a new entry level MacBook. Leaks and industry chatter suggest the machine could be a sm…",2026-02-22,https://alltoc.com/lifestyle/is-a-low-cost-macbook-coming,"Is a low-cost MacBook coming? #lifestyle Apple event rumors and what to expect Reports point to an ""Apple Experience"" event scheduled for March 4 across New York, London, and Shanghai where the company may unveil a new entry level MacBook. Leaks and industry chatter suggest the machine could be a sm…"
AAPL,TechCrunch,"Move over, Apple: Meet the alternative app stores available in the EU and elsewhere | TechCrunch","Move over, Apple: Meet the alternative app stores available in the EU and elsewhere | TechCrunchtechcrunch.com",2026-02-22,https://techcrunch.com/2026/02/22/move-over-apple-meet-the-alternative-app-stores-available-in-the-eu-and-elsewhere/,"Move over, Apple: Meet the alternative app stores available in the EU and elsewhere | TechCrunch Move over, Apple: Meet the alternative app stores available in the EU and elsewhere | TechCrunchtechcrunch.com"
AAPL,Help Net Security,"Week in review: Firmware-level Android backdoor found on tablets, Dell zero-day exploited since 2024","Here’s an overview of some of last week’s most interesting news, articles, interviews and videos: Security at AI speed: The new CISO reality The CISO role has changed significantly over the past decade, but according to John White, EMEA Field CISO, Torq, the …",2026-02-22,https://www.helpnetsecurity.com/2026/02/22/week-in-review-firmware-level-android-backdoor-found-on-tablets-dell-zero-day-exploited-since-2024/,"Week in review: Firmware-level Android backdoor found on tablets, Dell zero-day exploited since 2024 Here’s an overview of some of last week’s most interesting news, articles, interviews and videos: Security at AI speed: The new CISO reality The CISO role has changed significantly over the past decade, but according to John White, EMEA Field CISO, Torq, the …"
AAPL,Pypi.org,cloakbrowser added to PyPI,Stealth Chromium that passes every bot detection test. Drop-in Playwright replacement with source-level fingerprint patches.,2026-02-22,https://pypi.org/project/cloakbrowser/,cloakbrowser added to PyPI Stealth Chromium that passes every bot detection test. Drop-in Playwright replacement with source-level fingerprint patches.
AAPL,The Daily Caller,Potent Nor’easter Bomb Cyclone To Blast Northeast With Largest Snowstorm In Years,Millions across the Interstate 95 corridor throughout the Northeast are getting prepared to be heavily impacted by a potent nor'easter bomb cyclone.,2026-02-22,https://dailycaller.com/2026/02/22/noreaster-bomb-cyclone-northeast-snowstorm-weather/,Potent Nor’easter Bomb Cyclone To Blast Northeast With Largest Snowstorm In Years Millions across the Interstate 95 corridor throughout the Northeast are getting prepared to be heavily impacted by a potent nor'easter bomb cyclone.
AAPL,Yugatech.com,Apple adds video podcasts to Apple Podcasts,"Apple has announced its latest update to Apple Podcasts. It will introduce video podcast support starting this spring. Apple Podcasts...
The post Apple adds video podcasts to Apple Podcasts appeared first on YugaTech | Philippines Tech News & Reviews.",2026-02-22,https://www.yugatech.com/news/apple-adds-video-podcasts-to-apple-podcasts/,"Apple adds video podcasts to Apple Podcasts Apple has announced its latest update to Apple Podcasts. It will introduce video podcast support starting this spring. Apple Podcasts...
The post Apple adds video podcasts to Apple Podcasts appeared first on YugaTech | Philippines Tech News & Reviews."
AAPL,Empire of The Kop,Klopp reveals what Milner took with him when he left Liverpool,"Jurgen Klopp has explained why James Milner’s Premier League appearance record is not just a number, because it is built on discipline, influence and an unusual mix of intensity and warmth that Live...",2026-02-22,https://www.empireofthekop.com/2026/02/22/klopp-reveals-what-milner-took-with-him-when-he-left-liverpool/,"Klopp reveals what Milner took with him when he left Liverpool Jurgen Klopp has explained why James Milner’s Premier League appearance record is not just a number, because it is built on discipline, influence and an unusual mix of intensity and warmth that Live..."
AAPL,Yugatech.com,OpenAI reportedly working on AI-Powered devices,"OpenAI is reportedly developing several AI-powered devices like smart glasses, a smart speaker and a smart lamp. According to The...
The post OpenAI reportedly working on AI-Powered devices appeared first on YugaTech | Philippines Tech News & Reviews.",2026-02-22,https://www.yugatech.com/news/openai-reportedly-working-on-ai-powered-devices/,"OpenAI reportedly working on AI-Powered devices OpenAI is reportedly developing several AI-powered devices like smart glasses, a smart speaker and a smart lamp. According to The...
The post OpenAI reportedly working on AI-Powered devices appeared first on YugaTech | Philippines Tech News & Reviews."
AAPL,Geeky Gadgets,"Apple’s Secret AI Wearables: Everything We Know About the New Glasses, Pin, and AirPods","Apple is reportedly developing a new lineup of AI-powered wearable devices, including AR glasses, an AI communication pin, and AI-enhanced AirPods. These devices are designed to transform how you interact with technology by using artificial intelligence to de…",2026-02-22,https://www.geeky-gadgets.com/apple-ai-wearables/,"Apple’s Secret AI Wearables: Everything We Know About the New Glasses, Pin, and AirPods Apple is reportedly developing a new lineup of AI-powered wearable devices, including AR glasses, an AI communication pin, and AI-enhanced AirPods. These devices are designed to transform how you interact with technology by using artificial intelligence to de…"
AAPL,Bavarian Football Works,What’s next — if anything — for rumors Bayern Munich transfer target Kennet Eichhorn?,FC Bayern would have competition for this phenom if he wants to move.,2026-02-22,https://www.bavarianfootballworks.com/bayern-munich-transfer-rumors-news/169889/whats-next-if-anything-for-rumors-bayern-munich-transfer-target-kennet-eichhorn,What’s next — if anything — for rumors Bayern Munich transfer target Kennet Eichhorn? FC Bayern would have competition for this phenom if he wants to move.
AAPL,Macworld,"Tech prices are going up, but these MacBooks are still under $200","Macworld







TL;DR: This MacBook Air is only $199.97 right now, and shipping is free.




The RAM shortage is already starting to affect computer prices, but it hasn’t touched refurbished devices yet. If you need a low-cost computer for the basics, this …",2026-02-22,https://www.macworld.com/article/3065178/tech-prices-are-going-up-but-these-macbooks-are-still-under-200.html,"Tech prices are going up, but these MacBooks are still under $200 Macworld







TL;DR: This MacBook Air is only $199.97 right now, and shipping is free.




The RAM shortage is already starting to affect computer prices, but it hasn’t touched refurbished devices yet. If you need a low-cost computer for the basics, this …"
AAPL,Prtimes.jp,【RORRY】Picky’sアワード2025受賞！「PalmGO」モバイルバッテリー Amazonセール情報,"[RORRY]
[画像1: https://prcdn.freetls.fastly.net/release_image/159488/153/159488-153-afae0c73bad8626d75d19bc4dfe0ed3b-1464x600.jpg?width=536&quality=85%2C75&format=jpeg&auto=webp&fit=bounds...",2026-02-22,https://prtimes.jp/main/html/rd/p/000000153.000159488.html,"【RORRY】Picky’sアワード2025受賞！「PalmGO」モバイルバッテリー Amazonセール情報 [RORRY]
[画像1: https://prcdn.freetls.fastly.net/release_image/159488/153/159488-153-afae0c73bad8626d75d19bc4dfe0ed3b-1464x600.jpg?width=536&quality=85%2C75&format=jpeg&auto=webp&fit=bounds..."
AAPL,Acast.com,"What Next: TBD | Tech, power, and the future - The Future of Retail is A.I.","You might not think you need artificial intelligence added to your shopping experience. Store employees might not see the point either. So why is it there anyway?Guest: Mia Sato, reporter at The Verge who covers tech companies, platforms, and users.Want more …",2026-02-22,https://shows.acast.com/whatnext-tbd-tech-power-and-the-future/episodes/the-future-of-retail-is-ai,"What Next: TBD | Tech, power, and the future - The Future of Retail is A.I. You might not think you need artificial intelligence added to your shopping experience. Store employees might not see the point either. So why is it there anyway?Guest: Mia Sato, reporter at The Verge who covers tech companies, platforms, and users.Want more …"
AAPL,Slickdeals.net,$64* | 4-Pack Apple AirTag Bluetooth Tracking Devices (1st Gen) at Amazon (2 replies),"Amazon [amazon.com] has 4-Pack Apple AirTag Bluetooth Tracking Devices (1st Gen) for $64.
Shipping is free.

Price
$35 lower (35% savings) than the list price of $99
$5.98 lower (9% savings) than the",2026-02-22,https://slickdeals.net/f/19236022-64-4-pack-apple-airtag-bluetooth-tracking-devices-1st-gen-at-amazon,"$64* | 4-Pack Apple AirTag Bluetooth Tracking Devices (1st Gen) at Amazon (2 replies) Amazon [amazon.com] has 4-Pack Apple AirTag Bluetooth Tracking Devices (1st Gen) for $64.
Shipping is free.

Price
$35 lower (35% savings) than the list price of $99
$5.98 lower (9% savings) than the"
AAPL,Giveawayoftheday.com,Daily Om Practice : ChantFlow,"Transform your Apple Watch into a sacred digital mala. ChantFlow guides your daily mantra practice with gentle haptic rhythms, tracks your spiritual journey with...",2026-02-22,https://iphone.giveawayoftheday.com/daily-om-practice-chantflow/,"Daily Om Practice : ChantFlow Transform your Apple Watch into a sacred digital mala. ChantFlow guides your daily mantra practice with gentle haptic rhythms, tracks your spiritual journey with..."
AAPL,Lifesciencesworld.com,Will deer eat my apple trees?,"Will Deer Eat My Apple Trees? Understanding and Protecting Your Orchard The answer is an emphatic yes: deer will eat your apple trees, and they can cause significant damage, especially to young trees and during harsh winters when other food sources are scarce…",2026-02-22,https://www.lifesciencesworld.com/will-deer-eat-my-apple-trees/,"Will deer eat my apple trees? Will Deer Eat My Apple Trees? Understanding and Protecting Your Orchard The answer is an emphatic yes: deer will eat your apple trees, and they can cause significant damage, especially to young trees and during harsh winters when other food sources are scarce…"
AAPL,Giveawayoftheday.com,KudosDeluxe,"Take control of your activity tracking with KudosDeluxe, the ultimate widget collection for iPhone and Apple Watch. Easily monitor your weekly activities, customize...",2026-02-22,https://iphone.giveawayoftheday.com/kudosdeluxe/,"KudosDeluxe Take control of your activity tracking with KudosDeluxe, the ultimate widget collection for iPhone and Apple Watch. Easily monitor your weekly activities, customize..."
AAPL,USA Today,"Nathaniel Hackett was never not the guy for Mike LaFleur, Cardinals","LaFleur on Hackett: ""Literally I wanted him and no one else, and he's here.""",2026-02-22,https://cardswire.usatoday.com/story/sports/nfl/cardinals/2026/02/21/nathaniel-hackett-was-never-not-the-guy-for-mike-lafleur-cardinals/88809062007/,"Nathaniel Hackett was never not the guy for Mike LaFleur, Cardinals LaFleur on Hackett: ""Literally I wanted him and no one else, and he's here."""
AAPL,Geeky Gadgets,Why the Galaxy Samsung S26 Ultra is the Choice for Pro Users in 2026.,"The Samsung Galaxy S26 Ultra is poised to make a significant impact in the smartphone industry with its innovative features and hardware. As the flagship model of the Galaxy S26 series, this device is designed to prioritize user privacy, deliver exceptional p…",2026-02-22,https://www.geeky-gadgets.com/samsung-galaxy-s26-ultra-pro-users/,"Why the Galaxy Samsung S26 Ultra is the Choice for Pro Users in 2026. The Samsung Galaxy S26 Ultra is poised to make a significant impact in the smartphone industry with its innovative features and hardware. As the flagship model of the Galaxy S26 series, this device is designed to prioritize user privacy, deliver exceptional p…"
