ticker,source,title,description,published_at,url,full_text
AAPL,Geeky Gadgets,"Google Pixel 11 Pro XL: Release Date, MediaTek 5G Details, and New AI Features","The Google Pixel 11 Pro XL is poised to make a significant impact in the competitive smartphone market. By focusing on core enhancements such as security, processing power, and efficiency, Google aims to deliver a device that meets the evolving needs of moder…",2026-02-22,https://www.geeky-gadgets.com/google-pixel-11-pro-xl-leaks-3/,"Google Pixel 11 Pro XL: Release Date, MediaTek 5G Details, and New AI Features The Google Pixel 11 Pro XL is poised to make a significant impact in the competitive smartphone market. By focusing on core enhancements such as security, processing power, and efficiency, Google aims to deliver a device that meets the evolving needs of moder…"
AAPL,Android Authority,Samsung and Apple are putting the variable aperture on the wrong camera,"We've heard rumors that Samsung and Apple could offer variable aperture main cameras, but I'd like to see this tech on a different camera.",2026-02-22,https://www.androidauthority.com/samsung-apple-variable-aperture-wrong-camera-3640280/,"Samsung and Apple are putting the variable aperture on the wrong camera We've heard rumors that Samsung and Apple could offer variable aperture main cameras, but I'd like to see this tech on a different camera."
AAPL,Github.com,Show HN: SergioAI – Trello bot with Claude that reviews PRDs and opens draft PRs,"I built an open-source bot that turns Trello cards into working code using Claude Code.Drop a task card in a list → Sergio picks it up, explores your codebase, and posts an implementation plan as a comment. Add feedback, move the card back, and iterate. When …",2026-02-22,https://github.com/Belfio/sergio,"Show HN: SergioAI – Trello bot with Claude that reviews PRDs and opens draft PRs I built an open-source bot that turns Trello cards into working code using Claude Code.Drop a task card in a list → Sergio picks it up, explores your codebase, and posts an implementation plan as a comment. Add feedback, move the card back, and iterate. When …"
AAPL,Science Daily,Pecans found to improve cholesterol and boost heart health,"A sweeping new scientific review suggests that pecans — America’s native nut — may pack more heart power than many people realize. After analyzing over 20 years of research, scientists found consistent evidence that eating pecans can improve key markers of ca…",2026-02-22,https://www.sciencedaily.com/releases/2026/02/260221000317.htm,"Pecans found to improve cholesterol and boost heart health A sweeping new scientific review suggests that pecans — America’s native nut — may pack more heart power than many people realize. After analyzing over 20 years of research, scientists found consistent evidence that eating pecans can improve key markers of ca…"
AAPL,9to5Mac,"Apple testing new ‘deep red’ color for iPhone 18 Pro, no ‘fun colors’ for iPhone Fold: report","iPhone 18 Pro is still well over half a year away. Nonetheless, we have some interesting new color rumors for the upcoming new iPhone model, and Apple may finally be doing something users have wanted for ages – a red ‘Pro’ iPhone. iPhone Fold, on the other ha…",2026-02-22,https://9to5mac.com/2026/02/22/iphone-18-pro-rumored-to-come-in-new-red-color-iphone-fold-details/,"Apple testing new ‘deep red’ color for iPhone 18 Pro, no ‘fun colors’ for iPhone Fold: report iPhone 18 Pro is still well over half a year away. Nonetheless, we have some interesting new color rumors for the upcoming new iPhone model, and Apple may finally be doing something users have wanted for ages – a red ‘Pro’ iPhone. iPhone Fold, on the other ha…"
AAPL,Smokingmusket.com,WVU held TCU to 60 points and 34% shooting — and still lost. Josh breaks down the offensive drought and why the Frog Court Curse continues on Unreasonable Doubt.,"WVU defended well enough to win in Fort Worth, but two points in the final five and a half minutes doomed the Mountaineers in a 60–54 loss to TCU. Josh unpacks the late-game offense, turnover issues, rebounding gap, and the bigger scoring problem that keeps s…",2026-02-22,https://www.smokingmusket.com/unreasonable-doubt/40200/wvu-unreasonable-doubt-tcu-loss,"WVU held TCU to 60 points and 34% shooting — and still lost. Josh breaks down the offensive drought and why the Frog Court Curse continues on Unreasonable Doubt. WVU defended well enough to win in Fort Worth, but two points in the final five and a half minutes doomed the Mountaineers in a 60–54 loss to TCU. Josh unpacks the late-game offense, turnover issues, rebounding gap, and the bigger scoring problem that keeps s…"
AAPL,9to5Mac,Report: Apple to launch ‘at least five products’ leading into March 4 event,"Last week, Apple announced a special Apple experience in various cities around the globe – taking place on March 4th. While this is unlikely to be a traditional Apple event, theres still ‘at least’ five new products set to launch at this event, per Bloomberg.…",2026-02-22,https://9to5mac.com/2026/02/22/apple-launching-at-least-five-products-next-week-with-march-4-event-report/,"Report: Apple to launch ‘at least five products’ leading into March 4 event Last week, Apple announced a special Apple experience in various cities around the globe – taking place on March 4th. While this is unlikely to be a traditional Apple event, theres still ‘at least’ five new products set to launch at this event, per Bloomberg.…"
AAPL,Dealnews.com,Phone Case Clearance Deals at Woot: Up to 92% off + free shipping,"Get deals on a selection of clearance phone cases for both Android and Apple phones, with most priced at $5. We've pictured the Flaunt Official Square Protective Case for iPhone Air for $5 ($55 off). Shop Now at Woot! An Amazon Company",2026-02-22,https://www.dealnews.com/Phone-Case-Clearance-Deals-at-Woot-Up-to-92-off-free-shipping/21811825.html,"Phone Case Clearance Deals at Woot: Up to 92% off + free shipping Get deals on a selection of clearance phone cases for both Android and Apple phones, with most priced at $5. We've pictured the Flaunt Official Square Protective Case for iPhone Air for $5 ($55 off). Shop Now at Woot! An Amazon Company"
AAPL,Dealnews.com,"Amazon Basics 3""x3"" 100-Sheet Sticky Notes 5-Pack for $3 + free shipping w/ Prime",That's half of what you'd pay at Amazon. Buy Now at Woot! An Amazon Company,2026-02-22,https://www.dealnews.com/Amazon-Basics-3-x3-100-Sheet-Sticky-Notes-5-Pack-for-3-free-shipping-w-Prime/21811824.html,"Amazon Basics 3""x3"" 100-Sheet Sticky Notes 5-Pack for $3 + free shipping w/ Prime That's half of what you'd pay at Amazon. Buy Now at Woot! An Amazon Company"
AAPL,9to5Toys,Amazon has Black/Natural Apple Watch Ultra 2 at $360 off the orig. price (Renewed Premium),"Amazon is now offering a few originally $799 Apple Watch Ultra 2 configs down at$439 shipped right now – Natural Titanium with blue Ocean Band, Natural Titanium with white Ocean Band, and the Black Titanium model with the Black Ocean Band. You’re looking at A…",2026-02-22,http://9to5toys.com/2026/02/22/amazon-apple-watch-ultra-2-deals/,"Amazon has Black/Natural Apple Watch Ultra 2 at $360 off the orig. price (Renewed Premium) Amazon is now offering a few originally $799 Apple Watch Ultra 2 configs down at$439 shipped right now – Natural Titanium with blue Ocean Band, Natural Titanium with white Ocean Band, and the Black Titanium model with the Black Ocean Band. You’re looking at A…"
AAPL,The Times of India,Riddhi Kumar reflects on her journey on her birthday: Life has a way of bringing small miracles,"On her birthday, Riddhi Kumar reflects on her simple celebrations, her journaling ritual and the career moments that shaped her path. The actor speaks about perspective, gratitude and the small miracles that define her journey.",2026-02-22,https://timesofindia.indiatimes.com/entertainment/hindi/bollywood/news/riddhi-kumar-reflects-on-her-journey-on-her-birthday-life-has-a-way-of-bringing-small-miracles/articleshow/128677592.cms,"Riddhi Kumar reflects on her journey on her birthday: Life has a way of bringing small miracles On her birthday, Riddhi Kumar reflects on her simple celebrations, her journaling ritual and the career moments that shaped her path. The actor speaks about perspective, gratitude and the small miracles that define her journey."
AAPL,Slashdot.org,How to send a message via satellite on iPhone,"Apple’s satellite features were originally designed for emergencies, allowing iPhone users to contact emergency services when cellular and Wi-Fi coverage is unavailable. With recent versions of iOS, Apple has expanded those capabilities to include sending and…",2026-02-22,https://slashdot.org/firehose.pl?op=view&amp;id=180842386,"How to send a message via satellite on iPhone Apple’s satellite features were originally designed for emergencies, allowing iPhone users to contact emergency services when cellular and Wi-Fi coverage is unavailable. With recent versions of iOS, Apple has expanded those capabilities to include sending and…"
AAPL,OregonLive,We compared prices of 20 items at 8 grocery chains and discovered a staggering $76 difference,We compared prices of 20 items at 8 grocery chains and discovered a staggering $76 differenceoregonlive.com,2026-02-22,https://www.oregonlive.com/business/2026/02/we-compared-prices-of-20-items-at-8-grocery-chains-and-discovered-a-staggering-76-difference.html,We compared prices of 20 items at 8 grocery chains and discovered a staggering $76 difference We compared prices of 20 items at 8 grocery chains and discovered a staggering $76 differenceoregonlive.com
AAPL,OregonLive,Is Trader Joe’s actually cheaper? We bought the same groceries at 8 Portland grocery stores to find out,Is Trader Joe’s actually cheaper? We bought the same groceries at 8 Portland grocery stores to find outoregonlive.com,2026-02-22,https://www.oregonlive.com/business/2026/02/is-trader-joes-actually-cheaper-we-bought-the-same-groceries-at-8-portland-grocery-stores-to-find-out.html,Is Trader Joe’s actually cheaper? We bought the same groceries at 8 Portland grocery stores to find out Is Trader Joe’s actually cheaper? We bought the same groceries at 8 Portland grocery stores to find outoregonlive.com
AAPL,The Times of India,Work on Phase 1 of Kosi-Mechi river linking project commences,"Madhepura: Residents of the Kosi and Seemanchal regions may soon find relief from the perennial flood threat and gain improved irrigation facilities, .",2026-02-22,https://timesofindia.indiatimes.com/city/patna/work-on-phase-1-of-kosi-mechi-river-linking-project-commences/articleshow/128677234.cms,"Work on Phase 1 of Kosi-Mechi river linking project commences Madhepura: Residents of the Kosi and Seemanchal regions may soon find relief from the perennial flood threat and gain improved irrigation facilities, ."
AAPL,Fox News,Jimmy Lai is risking everything for democracy. We can't ignore what China is doing,"Chinese Communist Party destroyed publisher Jimmy Lai through asset freezes, staff arrests and harassment before imposing his prison sentence.",2026-02-22,https://www.foxnews.com/opinion/jimmy-lai-risking-everything-democracy-we-cant-ignore-what-china-doing,"Jimmy Lai is risking everything for democracy. We can't ignore what China is doing Chinese Communist Party destroyed publisher Jimmy Lai through asset freezes, staff arrests and harassment before imposing his prison sentence."
AAPL,Android Authority,"Android apps keep using Apple’s Liquid Glass design, and it’s killing me","Google finally created a bold and beautiful design language, and nobody is using it, not even on Android. This needs to change.",2026-02-22,https://www.androidauthority.com/android-apps-using-liquid-glass-3642290/,"Android apps keep using Apple’s Liquid Glass design, and it’s killing me Google finally created a bold and beautiful design language, and nobody is using it, not even on Android. This needs to change."
AAPL,Geeky Gadgets,Apple’s Liquid Glass Redesign Linked to Record-Low 45% Adoption Rate,"Apple’s introduction of the “Liquid Glass” design system with iOS 26 has sparked significant debate, as highlighted by Design Lovers below. This redesign represents a major departure from Apple’s historically user-focused approach, emphasizing a glossy, futur…",2026-02-22,https://www.geeky-gadgets.com/apple-liquid-glass-adoption-rate/,"Apple’s Liquid Glass Redesign Linked to Record-Low 45% Adoption Rate Apple’s introduction of the “Liquid Glass” design system with iOS 26 has sparked significant debate, as highlighted by Design Lovers below. This redesign represents a major departure from Apple’s historically user-focused approach, emphasizing a glossy, futur…"
AAPL,TechRadar,"Neuromancer is just the thing I needed to give me a dark, sci-fi hit while I wait for Cyberpunk 2",Let me introduce you to Neuromancer,2026-02-22,https://www.techradar.com/gaming/neuromancer-is-just-the-thing-i-needed-to-give-me-a-dark-sci-fi-hit-while-i-wait-for-cyberpunk-2,"Neuromancer is just the thing I needed to give me a dark, sci-fi hit while I wait for Cyberpunk 2 Let me introduce you to Neuromancer"
AAPL,Tom's Hardware UK,Computer History Museum unveils comically large-scale rendition of the 1986 Apple Macintosh Plus — 'Big Mac' celebrates 50th Apple anniversary towering all-in-one's keyboard looks disproportionately huge today,"Despite the whole design being massively scaled up, the monitor doesn’t look more than about 20-inches in diagonal.",2026-02-22,https://www.tomshardware.com/pc-components/case-mods/computer-history-museum-unveils-comically-large-scale-rendition-of-the-1986-apple-macintosh-plus-towering-all-in-ones-keyboard-looks-disproportionately-huge-today,"Computer History Museum unveils comically large-scale rendition of the 1986 Apple Macintosh Plus — 'Big Mac' celebrates 50th Apple anniversary towering all-in-one's keyboard looks disproportionately huge today Despite the whole design being massively scaled up, the monitor doesn’t look more than about 20-inches in diagonal."
AAPL,Dealnews.com,Arrowhead Outdoor Furniture at Woot: Up to 54% off + free shipping w/ Prime,"With the weather warming up soon, this is a great chance to refresh your outdoor furniture or get some gear for upcoming camping trips. We've pictured the Arrowhead Outdoor Heated Loveseat for $92 (low by $18). Shop Now at Woot! An Amazon Company",2026-02-22,https://www.dealnews.com/Arrowhead-Outdoor-Furniture-at-Woot-Up-to-54-off-free-shipping-w-Prime/21811822.html,"Arrowhead Outdoor Furniture at Woot: Up to 54% off + free shipping w/ Prime With the weather warming up soon, this is a great chance to refresh your outdoor furniture or get some gear for upcoming camping trips. We've pictured the Arrowhead Outdoor Heated Loveseat for $92 (low by $18). Shop Now at Woot! An Amazon Company"
AAPL,New York Post,NYC area set for 2 feet of snow in first dangerous blizzard in a decade — when to expect the worst,New York City is facing its first blizzard in more than a decade — as a powerful nor'easter bears down on the northeast.,2026-02-22,https://nypost.com/2026/02/22/us-news/nyc-area-set-to-get-2-feet-of-snow-in-first-dangerous-blizzard-in-a-decade-heres-when-it-starts/,NYC area set for 2 feet of snow in first dangerous blizzard in a decade — when to expect the worst New York City is facing its first blizzard in more than a decade — as a powerful nor'easter bears down on the northeast.
AAPL,Dealnews.com,Philips Hue Lighting Deals at Woot: Up to 72% off + free shipping w/ Prime,"Save on flood lights, light bars, ceiling lights, bulbs, and more from Philips. We've pictured the Philips Hue 65"" Smart LED TV Backlight for $136 ($161 off). Shop Now at Woot! An Amazon Company",2026-02-22,https://www.dealnews.com/Philips-Hue-Lighting-Deals-at-Woot-Up-to-72-off-free-shipping-w-Prime/21811820.html,"Philips Hue Lighting Deals at Woot: Up to 72% off + free shipping w/ Prime Save on flood lights, light bars, ceiling lights, bulbs, and more from Philips. We've pictured the Philips Hue 65"" Smart LED TV Backlight for $136 ($161 off). Shop Now at Woot! An Amazon Company"
AAPL,The Times of India,"This river flows in two directions at once, and scientists still can’t fully explain it","The Echimamish River in Manitoba is a rare natural phenomenon, flowing in two directions from a central pond to link the Hayes and Nelson Rivers, both draining to Hudson Bay. This unique bifurcation, influenced by beaver dams and subtle terrain, has historica…",2026-02-22,https://timesofindia.indiatimes.com/etimes/trending/this-river-flows-in-two-directions-at-once-and-scientists-still-cant-fully-explain-it/articleshow/128675975.cms,"This river flows in two directions at once, and scientists still can’t fully explain it The Echimamish River in Manitoba is a rare natural phenomenon, flowing in two directions from a central pond to link the Hayes and Nelson Rivers, both draining to Hudson Bay. This unique bifurcation, influenced by beaver dams and subtle terrain, has historica…"
AAPL,Notebookcheck.net,Lenovo Legion 5i gaming laptop with GeForce RTX 5070 gets $705 discount,"Deal | Courtesy of an ongoing sale on Lenovo's online store, the well-equipped Legion 5i 15 gaming laptop with a 20-core Intel Core Ultra 7 255HX CPU and RTX 5070 Laptop GPU can now be bought with an attractive $705 discount. The QHD gamer sports great perfor…",2026-02-22,https://www.notebookcheck.net/Lenovo-Legion-5i-gaming-laptop-with-GeForce-RTX-5070-gets-705-discount.1231748.0.html,"Lenovo Legion 5i gaming laptop with GeForce RTX 5070 gets $705 discount Deal | Courtesy of an ongoing sale on Lenovo's online store, the well-equipped Legion 5i 15 gaming laptop with a 20-core Intel Core Ultra 7 255HX CPU and RTX 5070 Laptop GPU can now be bought with an attractive $705 discount. The QHD gamer sports great perfor…"
AAPL,Dealnews.com,SanDisk Memory Deals at Woot for From $10 + free shipping w/ Prime,These are all factory reconditioned and come with a 90-day Woot limited warranty. We've pictured the SanDisk Ultra Plus 512GB microSDXC Memory Card for $35 ($45 less than you'd pay for a factory sealed version). Buy Now at Woot! An Amazon Company,2026-02-22,https://www.dealnews.com/San-Disk-Memory-Deals-at-Woot-for-From-10-free-shipping-w-Prime/21811819.html,SanDisk Memory Deals at Woot for From $10 + free shipping w/ Prime These are all factory reconditioned and come with a 90-day Woot limited warranty. We've pictured the SanDisk Ultra Plus 512GB microSDXC Memory Card for $35 ($45 less than you'd pay for a factory sealed version). Buy Now at Woot! An Amazon Company
AAPL,Dealnews.com,SanDisk Memory Deals at Woot for From $10 + free shipping w/ Prime,These are all factory reconditioned and come with a 90-day Woot limited warranty. We've pictured the SanDisk Ultra Plus 512GB microSDXC Memory Card for $35 ($45 less than you'd pay for a factory sealed version). Buy Now at Woot! An Amazon Company,2026-02-22,https://www.dealnews.com/San-Disk-Memory-Deals-at-Woot-for-From-10-free-shipping-w-Prime/21811819.html,SanDisk Memory Deals at Woot for From $10 + free shipping w/ Prime These are all factory reconditioned and come with a 90-day Woot limited warranty. We've pictured the SanDisk Ultra Plus 512GB microSDXC Memory Card for $35 ($45 less than you'd pay for a factory sealed version). Buy Now at Woot! An Amazon Company
AAPL,Dealnews.com,Motorola Walkie Talkie Radio Packs at Woot: Up to 59% off + free shipping w/ Prime,"Save on these 2- and 3-pack 2-way radio options from Motorola, with prices starting at just $17. We've pictured the Motorola T380 FRS Talkabout 2-Way Radio 2-Pack for $43 ($62 off). Shop Now at Woot! An Amazon Company",2026-02-22,https://www.dealnews.com/Motorola-Walkie-Talkie-Radio-Packs-at-Woot-Up-to-59-off-free-shipping-w-Prime/21811818.html,"Motorola Walkie Talkie Radio Packs at Woot: Up to 59% off + free shipping w/ Prime Save on these 2- and 3-pack 2-way radio options from Motorola, with prices starting at just $17. We've pictured the Motorola T380 FRS Talkabout 2-Way Radio 2-Pack for $43 ($62 off). Shop Now at Woot! An Amazon Company"
AAPL,Bavarian Football Works,Report: Real Madrid set to make blockbuster pursuit of Borussia Dortmund’s Nico Schlotterbeck,The rumored FC Bayern target could get an offer from Real Madrid.,2026-02-22,https://www.bavarianfootballworks.com/transfer-rumors/170408/report-real-madrid-set-to-make-blockbuster-pursuit-of-borussia-dortmunds-nico-schlotterbeck,Report: Real Madrid set to make blockbuster pursuit of Borussia Dortmund’s Nico Schlotterbeck The rumored FC Bayern target could get an offer from Real Madrid.
AAPL,Worldsoccertalk.com,How to watch Tottenham vs Arsenal in the USA: Live Stream and TV for 2025/2026 Premier League,"Tottenham clash with Arsenal in a Matchday 27 showdown of the 2025/2026 Premier League season. Here’s all the essential details you need to know, including kickoff times and how to watch the action live on TV and through streaming platforms.
 
Here are all of…",2026-02-22,https://worldsoccertalk.com/watch-on-us-tv/how-to-watch-tottenham-vs-arsenal-in-the-usa-live-stream-and-tv-for-2025-2026-premier-league/,"How to watch Tottenham vs Arsenal in the USA: Live Stream and TV for 2025/2026 Premier League Tottenham clash with Arsenal in a Matchday 27 showdown of the 2025/2026 Premier League season. Here’s all the essential details you need to know, including kickoff times and how to watch the action live on TV and through streaming platforms.
 
Here are all of…"
AAPL,Fortune,"A decade ago, I had a front row seat as Jesse Jackson held big tech firms accountable for being overwhelmingly white and male","In 2026, diversity efforts across tech companies and corporate America are facing rollbacks, precisely the moment Reverend Jackson warned about.",2026-02-22,https://fortune.com/2026/02/22/what-i-saw-working-with-jesse-jackson-big-tech-diversity-dei-a-decade-ago/,"A decade ago, I had a front row seat as Jesse Jackson held big tech firms accountable for being overwhelmingly white and male In 2026, diversity efforts across tech companies and corporate America are facing rollbacks, precisely the moment Reverend Jackson warned about."
AAPL,Github.com,Show HN: BoltFFI a high performance Rust bindings generator,"Built this because we were tired of fighting the same Rust FFI issues over and over
we wanted one rust exports model that can generate bindings for Swift Kotlin and WASM and also handle packaging without a bunch of manual glue. We are also adding more targets…",2026-02-22,https://github.com/boltffi/boltffi,"Show HN: BoltFFI a high performance Rust bindings generator Built this because we were tired of fighting the same Rust FFI issues over and over
we wanted one rust exports model that can generate bindings for Swift Kotlin and WASM and also handle packaging without a bunch of manual glue. We are also adding more targets…"
AAPL,Dealnews.com,Sonos Beam Gen 1 Smart Soundbar for $299 + free shipping,"It's $19 more for a refurbished version elsewhere. Buy Now at Woot! An Amazon Company 
 Features
 <ul> <li>control via voice, remote, the Sonos app, and more</li> <li>built-in Amazon Alexa</li> </ul>",2026-02-22,https://www.dealnews.com/Sonos-Beam-Gen-1-Smart-Soundbar-for-299-free-shipping/21811816.html,"Sonos Beam Gen 1 Smart Soundbar for $299 + free shipping It's $19 more for a refurbished version elsewhere. Buy Now at Woot! An Amazon Company 
 Features
 <ul> <li>control via voice, remote, the Sonos app, and more</li> <li>built-in Amazon Alexa</li> </ul>"
AAPL,Dealnews.com,Sonos Beam Gen 1 Smart Soundbar for $299 + free shipping,"It's $19 more for a refurbished version elsewhere. Buy Now at Woot! An Amazon Company 
 Features
 <ul> <li>control via voice, remote, the Sonos app, and more</li> <li>built-in Amazon Alexa</li> </ul>",2026-02-22,https://www.dealnews.com/Sonos-Beam-Gen-1-Smart-Soundbar-for-299-free-shipping/21811816.html,"Sonos Beam Gen 1 Smart Soundbar for $299 + free shipping It's $19 more for a refurbished version elsewhere. Buy Now at Woot! An Amazon Company 
 Features
 <ul> <li>control via voice, remote, the Sonos app, and more</li> <li>built-in Amazon Alexa</li> </ul>"
AAPL,Alltoc.com,What should I expect from Apple’s March 4 event? #lifestyle,"What the invite and early reports suggest Apple has scheduled an ""Apple Experience"" event for March 4 across multiple cities, and reports ahead of the show point to at least one new, lower cost MacBook. Rumors describe a sub‑13‑inch, entry level laptop offere…",2026-02-22,https://alltoc.com/lifestyle/what-should-i-expect-from-apples-march-4-event,"What should I expect from Apple’s March 4 event? #lifestyle What the invite and early reports suggest Apple has scheduled an ""Apple Experience"" event for March 4 across multiple cities, and reports ahead of the show point to at least one new, lower cost MacBook. Rumors describe a sub‑13‑inch, entry level laptop offere…"
AAPL,RTE,Foo Fighters announce last-minute Dublin gig,US rock band Foo Fighters have announced a last-minute surprise gig in Dublin tomorrow.,2026-02-22,https://www.rte.ie/entertainment/music/2026/0222/1559798-foo-fighters-dublin/,Foo Fighters announce last-minute Dublin gig US rock band Foo Fighters have announced a last-minute surprise gig in Dublin tomorrow.
