ticker,source,title,description,published_at,url,full_text
AAPL,New York Post,"Over 3,000 flights canceled at NYC airports as historic blizzard threatens to bury region in 2-feet of snow","With perilous conditions expected to batter the Northeast Sunday, several major airlines grounded flights Saturday at key hubs Saturday.",2026-02-22,https://nypost.com/2026/02/22/us-news/nyc-airports-cancel-3000-flights-ahead-of-winter-storm-hernando-historic-blizzard/,"Over 3,000 flights canceled at NYC airports as historic blizzard threatens to bury region in 2-feet of snow With perilous conditions expected to batter the Northeast Sunday, several major airlines grounded flights Saturday at key hubs Saturday."
AAPL,USA Today,Arizona Cardinals RB Emari Demercado 2026 offseason profile,"A look at running back Emari Demercado's season, his contract and what to expect in the offseason.",2026-02-22,https://cardswire.usatoday.com/story/sports/nfl/cardinals/2026/02/21/emari-demercados-contract-status-and-2026-offseason-outlook/88808833007/,"Arizona Cardinals RB Emari Demercado 2026 offseason profile A look at running back Emari Demercado's season, his contract and what to expect in the offseason."
AAPL,Alltoc.com,What will Apple announce March 4? #lifestyle,"A closer look at Apple’s rumored March product push Apple has sent invites for a March 4 “Apple Experience” event in New York, London, and Shanghai, and reports point to a new, lower‑cost MacBook in colorful finishes as one headline item. The machine is descr…",2026-02-22,https://alltoc.com/lifestyle/what-will-apple-announce-march-4,"What will Apple announce March 4? #lifestyle A closer look at Apple’s rumored March product push Apple has sent invites for a March 4 “Apple Experience” event in New York, London, and Shanghai, and reports point to a new, lower‑cost MacBook in colorful finishes as one headline item. The machine is descr…"
AAPL,Applech2.com,米Spigen、Macintosh 128KをモチーフとしたMagSafe対応ウォレット「Classic LS MagFit Wallet」とAirPods Pro 3ケース「Classic LS AirPods Pro 3」を発売。,"米SpigenがMacintosh 128KをモチーフとしたMagSafe対応ウォレット「Classic LS MagFit Wallet」とAirPods Pro 3ケース「Classic LS AirPods Pr […]
The post 米Spigen、Macintosh 128KをモチーフとしたMagSafe対応ウォレット「Classic LS MagFit Wallet」とAirPods Pro 3ケース「Classic LS AirPods Pro 3」を発売。 first appeared on …",2026-02-22,https://applech2.com/archives/20260222-spigen-classic-ls-magfit-wallet-and-airpods-pro-3-case.html,"米Spigen、Macintosh 128KをモチーフとしたMagSafe対応ウォレット「Classic LS MagFit Wallet」とAirPods Pro 3ケース「Classic LS AirPods Pro 3」を発売。 米SpigenがMacintosh 128KをモチーフとしたMagSafe対応ウォレット「Classic LS MagFit Wallet」とAirPods Pro 3ケース「Classic LS AirPods Pr […]
The post 米Spigen、Macintosh 128KをモチーフとしたMagSafe対応ウォレット「Classic LS MagFit Wallet」とAirPods Pro 3ケース「Classic LS AirPods Pro 3」を発売。 first appeared on …"
AAPL,Crosswalk.com,A Prayer for Fortitude to Fight Through Tough Times - Your Daily Prayer - February 22,"This season may break your heart, but it won’t break you. Jesus is near. His love gives you the strength to keep fighting forward.",2026-02-22,https://www.crosswalk.com/devotionals/your-daily-prayer/a-prayer-for-fortitude-to-fight-through-tough-times.html,"A Prayer for Fortitude to Fight Through Tough Times - Your Daily Prayer - February 22 This season may break your heart, but it won’t break you. Jesus is near. His love gives you the strength to keep fighting forward."
AAPL,Geeky Gadgets,SECRET iOS 26 Feature: Unlock ULTRA USB-C!,"The integration of the USB-C port into iPhones marks a significant evolution in functionality and versatility. This addition goes beyond aesthetics, introducing a range of practical applications that enhance the iPhone’s utility. From emergency charging to fa…",2026-02-22,https://www.geeky-gadgets.com/ios-26-unlock-ultra-usb-c/,"SECRET iOS 26 Feature: Unlock ULTRA USB-C! The integration of the USB-C port into iPhones marks a significant evolution in functionality and versatility. This addition goes beyond aesthetics, introducing a range of practical applications that enhance the iPhone’s utility. From emergency charging to fa…"
AAPL,Naturalnews.com,FDA’s latest infant food RECALL reveals gaping holes in food safety as industry giants profit from weak oversight,"Initiative Foods’ Tippy Toes Apple Pear Banana Fruit Puree was recalled after FDA testing found dangerously high levels of patulin, a neurotoxic mold byproduct linked to immune suppression, nerve damage and DNA mutation. The affected batch (Lot #07174, Best B…",2026-02-22,https://www.naturalnews.com/2026-02-22-fda-latest-recall-holes-infant-food-safety.html,"FDA’s latest infant food RECALL reveals gaping holes in food safety as industry giants profit from weak oversight Initiative Foods’ Tippy Toes Apple Pear Banana Fruit Puree was recalled after FDA testing found dangerously high levels of patulin, a neurotoxic mold byproduct linked to immune suppression, nerve damage and DNA mutation. The affected batch (Lot #07174, Best B…"
AAPL,The Irish Times,Success of Eli Lilly’s weight loss drugs could fatten its Irish corporate tax bill,Budgetary watchdog publishes report on State’s highly concentrated corporate tax base,2026-02-22,https://www.irishtimes.com/business/2026/02/22/success-of-eli-lillys-weight-loss-drugs-could-fatten-its-irish-corporate-tax-bill/,Success of Eli Lilly’s weight loss drugs could fatten its Irish corporate tax bill Budgetary watchdog publishes report on State’s highly concentrated corporate tax base
AAPL,The Irish Times,Performative grief: Chappell Roan and Apple Martin learned the hard way about overblown sorrow,As people feel the need to pay social media tribute when a celebrity dies it’s impossible not to feel that the idea of sombre remembrance has been corrupted,2026-02-22,https://www.irishtimes.com/life-style/people/2026/02/21/performative-grief-chapelle-roan-and-apple-martin-learned-the-hard-way-about-overblown-sorrow/,Performative grief: Chappell Roan and Apple Martin learned the hard way about overblown sorrow As people feel the need to pay social media tribute when a celebrity dies it’s impossible not to feel that the idea of sombre remembrance has been corrupted
AAPL,Naturalnews.com,The unsung superfood: Jicama’s rise from Mexican staple to global health star,"Jicama is low in calories (46 kcal per cup), high in fiber (5.9g), vitamin C (27% DV) and prebiotic inulin, which feeds beneficial gut bacteria. It supports digestion, reduces inflammation and helps prevent dysbiosis. The root vegetable has a low glycemic ind…",2026-02-22,https://www.naturalnews.com/2026-02-22-superfood-jicama-mexican-staple-to-health-star.html,"The unsung superfood: Jicama’s rise from Mexican staple to global health star Jicama is low in calories (46 kcal per cup), high in fiber (5.9g), vitamin C (27% DV) and prebiotic inulin, which feeds beneficial gut bacteria. It supports digestion, reduces inflammation and helps prevent dysbiosis. The root vegetable has a low glycemic ind…"
AAPL,Betalist.com,Breadboard – The modern HyperCard—build apps using design and English,The modern HyperCard—build apps using design and English,2026-02-22,https://betalist.com/startups/breadboards,Breadboard – The modern HyperCard—build apps using design and English The modern HyperCard—build apps using design and English
AAPL,Slashdot.org,Zuckerberg Says He Contacted Tim Cook Over Children’s Social Media Safety Amid Ongoing Trial - Indian Defence Review,Zuckerberg Says He Contacted Tim Cook Over Children’s Social Media Safety Amid Ongoing TrialIndian Defence Review Mark Zuckerberg’s entourage threatened with contempt for wearing Meta AI glasses into a no-recording courtroomYahoo Opinion | Mark Zuckerberg fac…,2026-02-22,https://slashdot.org/firehose.pl?op=view&amp;id=180841448,Zuckerberg Says He Contacted Tim Cook Over Children’s Social Media Safety Amid Ongoing Trial - Indian Defence Review Zuckerberg Says He Contacted Tim Cook Over Children’s Social Media Safety Amid Ongoing TrialIndian Defence Review Mark Zuckerberg’s entourage threatened with contempt for wearing Meta AI glasses into a no-recording courtroomYahoo Opinion | Mark Zuckerberg fac…
AAPL,Hollywood Reporter,2026 Annie Awards Winners List 'KPop Demon Hunters' Sweeps,The animation honors are presented by the L.A. branch of the International Animated Film Association.,2026-02-22,http://www.hollywoodreporter.com/movies/movie-news/2026-annie-awards-winners-list-kpop-demon-hunters-sweeps-1236510457/,2026 Annie Awards Winners List 'KPop Demon Hunters' Sweeps The animation honors are presented by the L.A. branch of the International Animated Film Association.
AAPL,Github.com,"qwibitai/nanoclaw: A lightweight alternative to Clawdbot / OpenClaw that runs in Apple containers for security. Connects to WhatsApp, has memory, scheduled jobs, and runs directly on Anthropic's Agents SDK","A lightweight alternative to Clawdbot / OpenClaw that runs in containers for security. Connects to WhatsApp, has memory, scheduled jobs, and runs directly on Anthropic&#39;s Agents SDK - qwibitai/n...",2026-02-22,https://github.com/qwibitai/nanoclaw,"qwibitai/nanoclaw: A lightweight alternative to Clawdbot / OpenClaw that runs in Apple containers for security. Connects to WhatsApp, has memory, scheduled jobs, and runs directly on Anthropic's Agents SDK A lightweight alternative to Clawdbot / OpenClaw that runs in containers for security. Connects to WhatsApp, has memory, scheduled jobs, and runs directly on Anthropic&#39;s Agents SDK - qwibitai/n..."
AAPL,Variety,‘KPop Demon Hunters’ Takes Top Prize at Annie Awards: Full Winners List,"“KPop Demon Hunters” led with 10 wins at the 53rd Annie Awards, taking home trophies for best feature, character animation, direction and production design, among others. The awards, considered animation’s highest honor, were presented at UCLA’s Royce Hall in…",2026-02-22,https://variety.com/2026/film/news/annie-awards-winners-kpop-demon-hunters-1236669259/,"‘KPop Demon Hunters’ Takes Top Prize at Annie Awards: Full Winners List “KPop Demon Hunters” led with 10 wins at the 53rd Annie Awards, taking home trophies for best feature, character animation, direction and production design, among others. The awards, considered animation’s highest honor, were presented at UCLA’s Royce Hall in…"
AAPL,IndieWire,‘KPop Demon Hunters’ Leads 2026 Annie Award Winners — Full List,"Read the full list for the Annie Award winners, including ""KPOP Demon Hunters,"" ""Arco,"" and more.",2026-02-22,https://www.indiewire.com/awards/results/2026-annie-award-winners-full-list-1235180601/,"‘KPop Demon Hunters’ Leads 2026 Annie Award Winners — Full List Read the full list for the Annie Award winners, including ""KPOP Demon Hunters,"" ""Arco,"" and more."
AAPL,TheWrap,‘KPop Demon Hunters’ Nearly Sweeps Annie Awards With 10 Film Wins,"“Common Side Effects” led all TV series with four wins
The post ‘KPop Demon Hunters’ Nearly Sweeps Annie Awards With 10 Film Wins appeared first on TheWrap.",2026-02-22,https://www.thewrap.com/industry-news/awards/kpop-demon-hunters-dominates-annie-awards-winners/,"‘KPop Demon Hunters’ Nearly Sweeps Annie Awards With 10 Film Wins “Common Side Effects” led all TV series with four wins
The post ‘KPop Demon Hunters’ Nearly Sweeps Annie Awards With 10 Film Wins appeared first on TheWrap."
